{
  "type": "device.servo.calibration.set",
  "timestamp": "2026-03-20T10:00:02Z",
  "session_id": "550e8400-e29b-41d4-a716-446655440000",
  "sequence": 12,
  "version": "1.0",
  "payload": {
    "request_id": "calib-set-001",
    "axis": "x",
    "center_offset_deg": 3.0,
    "min_deg": -45,
    "max_deg": 45,
    "invert": false,
    "speed_limit_deg_per_sec": 60,
    "soft_start": true,
    "home_deg": 0
  }
}
